{
  "schema": "https://github.com/3leaps/sfetch/schemas/update-target.schema.json",
  "version": 1,
  "source": {
    "type": "github",
    "apiBase": "https://api.github.com",
    "downloadBase": "https://github.com"
  },
  "repo": {
    "id": "3leaps/sfetch"
  },
  "versioning": {
    "comparator": "semver"
  },
  "repoConfig": {
    "binaryName": "sfetch",
    "hashAlgo": "sha256",
    "archiveType": "tar.gz",
    "archiveExtensions": [".tar.gz", ".tgz", ".tar.xz", ".txz", ".tar.bz2", ".tbz2", ".tar", ".zip"],
    "assetPatterns": [
      "(?i)^{{binary}}[_-]{{osToken}}[_-]{{archToken}}.*",
      "(?i)^{{binary}}.*{{osToken}}.*{{archToken}}.*"
    ],
    "checksumCandidates": [
      "{{asset}}.sha256",
      "{{asset}}.sha256.txt",
      "{{base}}.sha256",
      "{{base}}.sha256.txt",
      "SHA2-256SUMS",
      "SHA2-512SUMS",
      "SHA2-256SUMS.txt",
      "SHA2-512SUMS.txt",
      "SHA512SUMS",
      "SHA512SUMS.txt",
      "{{binary}}_{{versionNoPrefix}}_checksums.txt",
      "{{binary}}_{{version}}_checksums.txt",
      "{{binary}}_checksums.txt",
      "SHA256SUMS",
      "SHA256SUMS.txt",
      "SHA256SUMS_64",
      "sha256sum.txt",
      "checksums.txt",
      "CHECKSUMS",
      "CHECKSUMS.txt"
    ],
    "checksumSigCandidates": [
      "SHA2-256SUMS.minisig",
      "SHA2-512SUMS.minisig",
      "SHA256SUMS.minisig",
      "SHA512SUMS.minisig",
      "SHA256SUMS.txt.minisig",
      "checksums.txt.minisig",
      "CHECKSUMS.minisig",
      "SHA2-256SUMS.asc",
      "SHA2-512SUMS.asc",
      "SHA256SUMS.asc",
      "SHA512SUMS.asc",
      "SHA256SUMS.txt.asc",
      "checksums.txt.asc",
      "CHECKSUMS.asc",
      "SHA2-256SUMS.sig",
      "SHA2-512SUMS.sig",
      "SHA256SUMS.sig",
      "SHA512SUMS.sig",
      "checksums.txt.sig",
      "CHECKSUMS.sig"
    ],
    "signatureCandidates": [
      "{{asset}}.minisig",
      "{{asset}}.sig",
      "{{asset}}.sig.ed25519",
      "{{base}}.sig",
      "{{base}}.sig.ed25519",
      "{{asset}}.asc",
      "{{base}}.asc"
    ],
    "signatureFormats": {
      "minisign": [".minisig"],
      "pgp": [".asc", ".gpg", ".sig.asc"],
      "ed25519": [".sig.ed25519"]
    },
    "preferChecksumSig": true
  }
}
